Organization Id,Organization Name,Short Name,Organization Description,Organization Summary,Organization Type,Status,Website Url,Facebook Url,Instagram Url,Twitter Url,YouTube Channel Url,Parent Organization Name
298404,Japanese Student Organization,JSO,"<p>Regardless of nationality, race, or creed, people have dreams. These dreams, and the paths we take in life may one day lead someone to Japan. Above all though, the members of the Japanese Student Organization are citizens of the earth. We work to not only improve ourselves and the community but the world as well. The Japanese Student Organization (JSO) was established by University of Oregon students to support Japanese students in their endeavors in the United States, as well as to introduce Japanese language and culture to non-Japanese students and community members interested in world cultures.</p>\r\n<p>JSO holds bi-weekly meetings throughout the school year as well as special events like our annual ""Japan Night"" culture showcase celebration that draws in over 300 guests each year! Our meetings and activities encompass a large variety of themes such as Japanese and American food and culture, language, traditions, current events, Japanese movie nights, and much more! All are welcome to join!&nbsp;</p>\r\n<p>Be sure to follow us on Instagram for additional updates and ways to get involved as well! We hope to meet you in the near future!&nbsp;</p>","The UO Japanese Student Organization holds bi-weekly meetings throughout the school year as well as special events like our annual ""Japan Night"" cultural showcase celebration! All are welcome and make sure to follow our Instagram for additional updates!",Tier 3 Student Organization,Active,,,https://www.instagram.com/uojso/?hl=en,,,ASUO Student Organizations
298405,Graduate Ecology and Evolutionary Biology Students,GrEBES,"<p>We are the organization of the graduate students in the Institute of Ecology and Evolution.</p>\r\n<p>Our mission:</p>\r\n<p>1) Enhance graduate student communication and relationships with the other graduate students, the Biology Faculty, and the GTFF.</p>\r\n<p>2) Encourage academic leadership among biology graduate students by hosting seminar speakers in ecology and evolutionary biology, subsidizing student research and travel to scientific meetings, offering workshops to advise undergraduates considering graduate degrees in the life sciences, and providing research funds for undergraduate research projects under GrEBES mentorship.</p>\r\n<p>3) Provide graduate students, post-doctoral fellows, and undergraduates with career-building advice through a series of informal workshops or seminars.</p>\r\n<p>4) Participate in community service and outreach programs outside of the UO campus.</p>","We are the organization of the graduate students in the Institute of Ecology and Evolution Our mission:1. Enhance graduate student communication and relationships with the other graduate students, the Biology Faculty and the GTFF.2. Encourage academic ...",Tier 3 Student Organization,Active,https://grebesuo.wordpress.com/,,,,,ASUO Student Organizations
298406,Muslim Student Association,MSA,"<p>The Muslim Student Association (MSA) is a community organization that serves as an inclusive and supportive space for all Muslims, and aims to both educate and advocate within the larger UO community. As a group, we are justice-oriented, and center our various communities in the work we do.</p>\r\n<p>If you have any questions, or are interested in joining our mailing list, please feel free to reach out here on Engage or through our Instagram linked below!</p>","The Muslim Student Association is a community organization that serves as an inclusive and supportive space for all Muslims, and aims to both educate and advocate within the larger UO community. We center our work around justice, compassion and community",Tier 4 Student Organization,Active,http://instagram.com/uo_msa,,https://www.instagram.com/uo_msa/,http://twitter.com/asuomsa,,ASUO Student Organizations
298407,PrePharmacy Club,PrePharm,"The University of Oregon Pre-Pharmacy Club is a campus organization devoted to providing guidance to the undergraduate interested in a future in the pharmacy field. The Pre-Pharmacy Club is an excellent and informal way to gain advice from experienced peers about classes, requirements, and the daunting pharmacy school application process.  ",The University of Oregon Pre-Pharmacy Club is a campus organization devoted to providing guidance to the undergraduate interested in a future in the pharmacy field. The Pre-Pharmacy Club is an excellent and informal way to gain advice from experienced ...,Hidden,Inactive,,http://facebook.com/groups/151917788600337/,,,,ASUO Student Organizations
298408,Journal of Environmental Law and Litigation,JELL,"<p>The Journal of Environmental Law and Litigation (JELL) has provided a national, unbiased forum for the discussion and presentation of new ideas and theories in environmental and natural resources law since 1985. JELL educates students for careers in environmental law, disseminates important information to the environmental community, and plays an integral role at the University of Oregon Law School's nationally and internationally recognized environmental law program.</p>","The Journal of Environmental Law and Litigation (JELL) has provided a national, unbiased forum for the discussion and presentation of new ideas and theories in environmental and natural resources law since 1985. JELL educates students for careers in en...",Tier 2 Student Organization,Active,,https://www.facebook.com/UOJELL,,,,ASUO Student Organizations
298410,Climate Justice League,CJL,"<p>The mission of the Climate Justice League is to empower students to organize their communities and be leaders in the climate justice movement. By using targeted campaigns, we will work together toward a safe, just and sustainable future for all.</p>\r\n<p>Our current three campaigns are Forest Defense, Fossil Free UO, and the Climate Justice Network (podcast).&nbsp;</p>","The mission of the Climate Justice League is to empower students to organize their communities and be leaders in the climate justice movement. By using targeted campaigns, we will work together toward a safe, just, and sustainable future for all.",Tier 3 Student Organization,Active,http://www.climatejusticeleague.org,,http://www.instagram.com/climatejusticeleague/,,,ASUO Student Organizations
298411,Green Business Initiative Student Association,GBISA,"<p>The Green Business Initiative Student Association (GBISA) is one of the first student organizations of its kind. Comprised of graduate students from the University of Oregon School of Law and the Lundquist College of Business, GBISA members are interested in and dedicated to the intersection of law, business, and the environment. GBISA&rsquo;s mission is to promote awareness of sustainable business practices and the legal framework and policies that support green business. GBISA&rsquo;s leading activity each year is to organize its annual Green Business Symposium at the White Stag Block in Portland, Oregon. The Symposium aims to be the premier student-organized green business conference in the Pacific Northwest. The Symposium brings together hundreds of regional and national business leaders, policymakers, legal practitioners, academics, and students to engage in discussions on how we as a society can achieve a more sustainable economy and living environment.</p>","The Green Business Initiative Student Association (GBISA) is one of the first student organizations of its kind. Comprised of graduate students from the University of Oregon School of Law and the Lundquist College of Business, GBISA members are interes...",Tier 4 Student Organization,Active,,,,,,ASUO Student Organizations
298412,Kultura Pilipinas,KP,"<p>Kultura Pilipinas (KP) is the University of Oregon&rsquo;s official Filipino American Student Alliance in association with NWFASA (Northwest Filipino American Student Alliance). KP welcomes anyone, regardless of ethnicity, who wishes to interact with the Filipino community and learn about its culture and heritage.</p>\r\n<p>Our General Meetings are every Monday 6-7pm, check our Instagram @uokulturapilipinas for the location.&nbsp;</p>",Kultura Pilipinas is a student organization that acts as a solid foundation and social forum for people of Filipino descent and for people who aim to learn about Filipino culture and heritage. ,Tier 4 Student Organization,Active,,http://facebook.com/kulturapilipinas,http://instagram.com/uokulturapilipinas/,http://twitter.com/uopinoys,,ASUO Student Organizations
298417,Pocket Playhouse,Pocket,"<p>The Pocket is a student run organization that helps students craft their artistic visions on the stage. Each quarter, the Pocket produces up to 5 shows, completely under the direction and operation of students. Many productions are original, some are new renderings of old classics, and some are obscure offerings seldom seen on stage, but they all come from the vision of directors, actors and designers just like you! The Pocket Playhouse aims to provide an arena for students to get involved in all aspects of theatre regardless of prior experience. We believe that no amount of classroom time can offer a student the opportunity to learn what hands-on experience offers by definition. Every student who desires it should have a place, a time, and an opportunity for that kind of experience. The Pocket remains an open venue for any and every student seeking the opportunity to pursue their creative vision in the Art of Theatre.</p>","The Pocket is a student run organization that helps students craft their artistic visions on the stage. Each quarter, the Pocket produces up to 5 shows, completely under the direction and operation of students. Many productions are original, some are n...",Tier 3 Student Organization,Active,,http://facebook.com/thepocketplayhouse,https://www.instagram.com/pocketplayhouse/,http://twitter.com/pocketplayhouse,,ASUO Student Organizations
298419,Mind the Gap,MtG,"<p>Mind the Gap is the University of Oregon's gender-inclusive a cappella group! We cover all kinds of music from oldies to alternative to pop. We rehearse three times a week, hold weekly Friday show at the EMU with On the Rocks and Divisi, perform at community gigs, and compete on national and international levels. We have auditions twice a year, Fall and Spring. If you like to sing and perform, come check us out!</p>",Mind the Gap is the University of Oregon's gender-inclusive a cappella group! We cover all kinds of music from oldies to alternative to pop. We rehearse three times a week to prepare us for our weekly Friday show at the EMU with On the Rocks and Divisi...,Tier 3 Student Organization,Active,http://uomtg.com,http://facebook.com/uomindthegap,https://www.instagram.com/uomindthegap/,http://twitter.com/uomindthegap,https://www.youtube.com/user/UOmindthegap,ASUO Student Organizations
298420,Psi Chi,Psi Chi,"<p>Psi Chi is an international honor society that encourages, stimulates, and maintains excellence in scholarship of individuals in all fields, particularly psychology, and advances the science of psychology.</p>","Psi Chi is an international honor society that encourages, stimulates, and maintains excellence in scholarship of individuals in all fields, particularly psychology, and advances the science of psychology.",Tier 2 Student Organization,Active,https://blogs.uoregon.edu/psichi/,https://www.facebook.com/groups/1913422668950168/,https://www.instagram.com/uopsichi/,,,ASUO Student Organizations
298421,Taiwanese Student Association,TWSA,"<p>The mission of the Taiwanese Students Association (TWSA) is to coordinate academic, social, and cultural activities for Taiwanese students and&nbsp;other University of Oregon students. We are dedicated to assisting students with&nbsp;Taiwanese backgrounds&nbsp;to adjust their life in the United States. We also strive to create a welcoming community between international and domestic students as well as Taiwanese and non-Taiwanese students. To do so, we create opportunities to enhance the relationship between TWSA members and the community&nbsp;by presenting cultural events and activities that stimulate a better understanding of Taiwanese culture and add cultural diversity at the University of Oregon.&nbsp;</p>","The main purpose of the Taiwanese Students Association (TWSA) is to coordinate academic, social, and cultural activities for Taiwanese students as well as UO community members interested in Taiwanese culture.",Tier 3 Student Organization,Active,,https://www.facebook.com/groups/uotwsa/,https://www.instagram.com/uo_twsa/,,,ASUO Student Organizations
298423,Philosophy Club,Philosophy Club,"This club represents the interests and activities of the graduate student body of the philosophy department at the University of Oregon.  Through the Philosophy Club grad students are able to share and workshop their current research, build community through social activities and engage with the broader philosophical community on campus through the annual What Is...? Conference, which invites undergrads, grads, and professors to present on a new topic each year.","This club represents the interests and activities of the graduate student body of the philosophy department at the University of Oregon.  Through the Philosophy Club grad students are able to share and workshop their current research, build community t...",Hidden,Inactive,,,,,,ASUO Student Organizations
298425,National Society of Leadership and Success (Sigma Alpha Pi),NSLS,"<p>The National Society of Leadership and Success or NSLS is an organization that focuses on instilling members with the skills, tools, and techniques to become outstanding leaders. Our organization&nbsp;provides members with access to a job bank full of employment opportunities, awards &amp; scholarships, and&nbsp;live interviews with America's distinguished leaders!</p>","The National Society of Leadership and Success or NSLS is an organization that focuses on instilling members with the skills, tools, and techniques to become outstanding leaders. Our organization provides members with access to a job bank full of emplo.",Tier 1 Student Organization,Active,https://www.nsls.org/,,https://www.instagram.com/nslsuo/,,,ASUO Student Organizations
298428,University of Oregon Circle K International,UO CKI,"University of Oregon's Circle K International is a student-led service organization dedicated to helping the community through various service projects across the United States. It is part of an umbrella of organizations led by Kiwanis International. In addition to helping the community, Circle K International strives itself in building fellowship and creating leaders within the members. ",University of Oregon's Circle K International is a student-led service organization dedicated to helping the community through various service projects across the United States. It is part of an umbrella of organizations led by Kiwanis International. I...,Hidden,Inactive,,http://facebook.com/groups/32741833215/,,http://twitter.com/UOCKI,,ASUO Student Organizations
298429,Black Student Union,BSU,"<p>The Black Student Union is an organization whose primary function is the support of students of African descent on the campus of the University of Oregon. Through the promotion of academic achievement and sponsorship of cultural activities, the Black Student Union seeks to build and maintain community spirit among the University&rsquo;s African-American population that will enhance the educational and cultural development of the University community as a whole.</p>","The Black Student Union (BSU) sponsors cultural and social activities that serve the entire University of Oregon (U of O) community. Through these events, the BSU provides opportunities for students to develop leadership skills, a stimulating learning ...",Tier 4 Student Organization,Active,,,http://www.instagram.com/uobsu,http://twitter.com/@UOREGONBSU,,ASUO Student Organizations
298430,Divisi,,"<p>Divisi is the premier all-female a cappella singing group from the University of Oregon. Constantly striving to achieve the highest quality of music and performance, Divisi has become one of the most well-known and admired collegiate groups in the nation. Over their fourteen year existence, Divisi has toured the country, competed in the International Championship of Collegiate A Cappella, and recorded five highly praised albums. Divisi also continues to perform for free every Friday afternoon on the University of Oregon campus, as well as perform all over the state of Oregon. Divisi holds open auditions every Fall and every Spring term. If you are interested in auditioning, please check our website or email us for more details.</p>","Divisi is the premier all-female a cappella singing group from the University of Oregon.Constantly striving to achieve the highest quality of music and performance, Divisi has become one of the most well-known and admired collegiate groups in the natio...",Tier 2 Student Organization,Active,,,,http://twitter.com/uodivisi,,ASUO Student Organizations
298432,Vietnamese Student Association,VSA,"<p>The UO Vietnamese Student Association is a student organization that aims to promote Vietnamese and Vietnamese-American culture and awareness throughout campus and the Eugene community. Through working with other cultural groups on campus, we hope to contribute to the diverse UO community and promote it as one that is multifaceted, as well as rich with differences and similarities.</p>","The UO Vietnamese Student Association is a student organization that aims to promote Vietnamese and Vietnamese-American culture and awareness throughout campus and the Eugene community. Through working with other cultural groups on campus, we hope to c...",Tier 3 Student Organization,Active,http://vsa.uoregon.edu,http://facebook.com/uovsa,https://www.instagram.com/uovsa/?hl=en,http://twitter.com/uovsa,https://www.youtube.com/user/UOVSA,ASUO Student Organizations
298433,Net Impact Undergraduate Chapter,NIUG,"<p><span style=""font-weight: 400;"">Net Impact is a global network of over 435 chapters and 100,000 emerging leaders using the power of business to create a more just and sustainable world.</span></p>\r\n<p>&nbsp;</p>\r\n<p><span style=""font-weight: 400;"">We are the University of Oregon&rsquo;s Undergraduate Chapter of Net Impact, empowering students to navigate the intersection of business, social responsibility, and sustainability by facilitating networking trips, seminars, and social impact projects. Our aim is to develop our members&rsquo; professional skills and their expertise on sustainable business practices while also creating a tight-knit community of like-minded leaders.</span></p>\r\n<p>&nbsp;</p>\r\n<p><span style=""font-weight: 400;"">While housed in the Lundquist College of Business, we are open to students from all academic backgrounds. We also ensure free membership for all of our members thanks to our partners&mdash;the Center for Sustainable Business Practices and Associated Students of the University of Oregon. Our general meetings take place every Thursday at 6:00 PM in Lillis 455 or over Zoom.</span></p>","Net Impact Undergraduate Chapter at the University of Oregon is an international student-run nonprofit organization located in the Lundquist College of Business. We combine aspects of student culture, work, and having a positive net impact. We do this ..",Tier 4 Student Organization,Active,,http://facebook.com/UONIUndergrad,https://www.instagram.com/netimpactuo/,http://twitter.com/NetImpactUO,,ASUO Student Organizations
298435,Association of School Psychology Students,ASPS,"<p>The mission of ASPS is to provide support, advocacy, and leadership opportunities for SPSY students within the College of Education, the broader University of Oregon campus as well as in the community. ASPS strives to provide a collaborative environment for students to explore and address concerns that affect their educational experiences and environment through open dialogue, collaboration, and social interactions. ASPS seeks to promote student voices, support underrepresented students, foster awareness on diverse needs, engage in student advocacy that promotes the spirit of social justice, as well as actively address student issues.</p>","The mission of ASPS is to provide support, advocacy, and leadership opportunities for SPSY students within the College of Education, the broader University of Oregon campus as well as in the community. ASPS strives to provide a collaborative environmen...",Tier 2 Student Organization,Active,,,,,,ASUO Student Organizations
298437,UO Smash Club,UO Smash Club,"<p>The premier Super Smash Brothers group of the University of Oregon, we strive to create a safe space for all smashers. We play all smash games with a focus towards Melee and Ultimate, and hold weekly meetings on campus for anyone who wants to play. Bring what ever setups you can and please bring your own controller. Please join our Discord (<a class=""x_x_x_x_x_anchor-3Z-8Bb x_x_x_x_x_anchorUnderlineOnHover-2ESHQB"" tabindex=""0"" title=""https://discord.gg/KfFdmfv4C7"" href=""https://discord.gg/KfFdmfv4C7"" target=""_blank"" rel=""noreferrer noopener"">https://discord.gg/KfFdmfv4C7</a>) for the most up-to-date info, or check our Twitter for events!</p>","The premier Super Smash Brothers group of the University of Oregon, we strive to create a safe space for all smashers. We play all smash games with a focus towards Melee and Ultimate, and hold weekly meetings on campus.",Tier 2 Student Organization,Active,https://discord.gg/KfFdmfv4C7,,,,,ASUO Student Organizations
298443,Association of Women in Sports Media,AWSM,"The Association for Women in Sports Media (AWSM) is a 501(c)(3) nonprofit founded in 1987. AWSM works as a support network and advocacy group for women who work in sports writing, editing, broadcast and production, and public and media relations. AWSM works to increase diversity in sports media through their internship and scholarship programs. They provide mentoring for young female professionals entering into sports media.\r\n\r\nThe student chapter of AWSM at the University of Oregon was founded in 2014 by former student Beth Maiman and faculty advisor Lori Shontz.\r\n\r\nUO AWSM Mission Statement: Encouraging women to be leaders in the sports media industry by providing opportunities to learn about the varying professions and develop essential skills.\r\n","The Association for Women in Sports Media (AWSM) is a 501(c)(3) nonprofit founded in 1987. AWSM works as a support network and advocacy group for women who work in sports writing, editing, broadcast and production, and public and media relations. AWSM ...",Tier 1 Student Organization,Active,,http://facebook.com/awsmuo,,http://twitter.com/awsmuo,,ASUO Student Organizations
298444,University of Oregon College Republicans,UOCR,"<p>The College Republican National Committee is the oldest, largest, and most active youth political organization in America, and the grassroots arm of the Republican Party--a counterbalance to unions and leftist interest groups. Founded in 1892, there are currently over 250,000 CR&rsquo;s around the country on 1,800+ campuses in every state and DC. This is but one chapter, based at the University of Oregon in Eugene. For many students, campus activism is their gateway into the Republican Party. Our organization recruits, trains, mobilizes, and engages college-aged students to win elections and advocate for conservative ideals. Whether disseminating campaign literature, canvassing neighborhoods, placing lawn signs, or calling voters, our efforts make the difference in local Republican victories and help to drive our party forward.&nbsp;</p>\r\n<p>College Republicans at the University of Oregon meet every Thursday in Lillis 175 6-7pm. Join us for discussions about news, politics, and more!</p>","College Republicans at the University of Oregon meet every Tuesday at 7pm in Lillis 175. Join us for discussions about news, politics, and more!",Tier 2 Student Organization,Active,http://uocollegerepublicans.com,http://facebook.com/UOGOP,,http://twitter.com/UOGOP,https://www.youtube.com/channel/UCVhxNnjiv2MoXRIboM2ms6A?view_as=subscriber,ASUO Student Organizations
298446,UO Foreign Policy Forum (formerly Alexander Hamilton Society),FPF,"The University of Oregon Foreign Policy Forum (FPF) is an independent, non-partisan, not-for-profit organization dedicated to promoting constructive debate and discussion on contemporary issues in foreign, economic, and national security policy.\r\n\r\nThe UO FPF particularly aims to foster a positive environment for critical engagement with a diverse array of viewpoints. All students interested in international affairs, regardless of major or political ideology, are welcome to join us!","The University of Oregon Foreign Policy Forum (FPF) is an independent, non-partisan, not-for-profit organization dedicated to promoting constructive debate and discussion on contemporary issues in foreign, economic, and national security policy.The UO ...",Hidden,Inactive,,,,,,ASUO Student Organizations
