Organization Id,Organization Name,Short Name,Organization Description,Organization Summary,Organization Type,Status,Website Url,Facebook Url,Instagram Url,Twitter Url,YouTube Channel Url,Parent Organization Name
298732,Our Revolution,UOS4OR,"<p>Our Revolution will reclaim democracy for the working people of our country by harnessing the transformative energy of the &ldquo;political revolution.&rdquo; Through supporting a new generation of progressive leaders, empowering millions to fight for progressive change and elevating the political consciousness, Our Revolution will transform American politics to make our political and economic systems once again responsive to the needs of working families. Our Revolution has three intertwined goals: to revitalize American democracy, empower progressive leaders and elevate the political consciousness</p>","Our Revolution will reclaim democracy for the working people of our country by harnessing the transformative energy of the “political revolution.” Through supporting a new generation of progressive leaders, empowering millions to fight for progressive ...",Independent Student Organization,Inactive,,,,,,CSI Registered Student Organizations
298733,Glorious Band,Band.G,We are a group that combining band music performing and video making.,We are a group that combining band music performing and video making.,Independent Student Organization,Inactive,,,,,,CSI Registered Student Organizations
298735,Campus Comedy Club,CCC,"<p>A group of comedians that would normally meet every week at 9 in the Falling Sky Pizzeria in the EMU. We work together to write, perform, and enjoy Comedy. Due to COVID restrictions, we are not currently meeting. But you're welcome to follow us on Instagram or Twitter if you're interested in learning more about the club!</p>","A group of (very funny) comedians who meet at a heretofore undetermined location. We work together to write, perform, and enjoy Comedy.",Independent Student Organization,Active,,https://www.facebook.com/standupsocietyUO/,https://www.instagram.com/uocampuscomedy/,,https://www.youtube.com/channel/UCD3mHh5oUDJDQqGIs-DEc9A,CSI Registered Student Organizations
298736,PPPM Peer Exchange,PE,"The Peer Exchange offers a safe space for marginalized students, students from underserved communities, and allies to seek support from each other. At our meetings we discuss gender, sexuality, race, nationality, intersectionality and other issues we experience in our daily life here at the UO.","The Peer Exchange offers a safe space for marginalized students, students from underserved communities, and allies to seek support from each other. At our meetings we discuss gender, sexuality, race, nationality, intersectionality and other issues we e...",Hidden,Inactive,,,,,,CSI Registered Student Organizations
298743,Middle Eastern and North African Student Alliance,MENASA,"The Middle Eastern and North African Student alliances at UO is an organization that aims to educate people on the modern and historical cultures that comprise the Region, to strives to make an unique community for students of all diverse and vary backgrounds from that area, to advocate for humanitarian rights and political stands of the people themselves, and to stand to decolonize orientalism and violence in those areas.\r\n","The Middle Eastern and North African Student alliances at UO is an organization that aims to educate people on the modern and historical cultures that comprise the Region, to strives to make an unique community for students of all diverse and vary back...",Independent Student Organization,Inactive,,,,,,CSI Registered Student Organizations
298749,Connect The Ducks,CSI CTD,"<p>Connect The Ducks is comprised of a group of UO students dedicated to planning and hosting events for UO students. These events are meant to foster a sense of belonging for UO students within the university community, and to provide a safe, fun space for UO students to be active on campus. Events include weekly bingo/trivia, Halloween activities, spring carnival, casino nights, and more.</p>\r\n<p>Purpose:&nbsp;Connect the Ducks' purpose is to facilitate interactive, safe events where students can come together as a community to connect with one another to create memorable experiences.&nbsp;</p>\r\n<p>Actions:​ We do this by hosting free themed events each term for UO students and faculty. Events, games, and activities often encourage students to connect with new people and participate together.</p>\r\n<p>&nbsp;</p>\r\n<p>Connect the Ducks is one of the five organizations within the <strong>Student Activities Board</strong>, or SAB.</p>\r\n<p>&nbsp;</p>\r\n<p><em>Keywords: Free Events, Bingo, Trivia, Theme, Nights, Activities, Competition, Prizes, Halloween, Casinos, Carnival, Trick or Treat, Fall, Spring, Winter, Summer.</em></p>",Connect The Ducks is comprised of a group of UO students dedicated to planning and hosting events for UO students. These events are meant to foster a sense of belonging for UO students within the university community.,Student Activities Board,Active,https://emu.uoregon.edu/csi,,https://www.instagram.com/connecttheducks/,,,CSI Registered Student Organizations
298750,Women in Computer Science,WiCS,"<p class=""font_7""><span class=""color_15"">WiCS provides support, opportunities, and tools for academic and professional success to underrepresented groups in technology and its related fields. We strive to foster a welcoming community and an ever-expanding network of students, alumni, and professionals. All majors, ages, and identities are welcome to join the Women in Computer Science organization.&nbsp;</span>In the past WiCS has hosted events like a resume building workshop with distinguished faculty, a senior-panel Q/A with graduating CS students, study nights, game nights, and so much more! Our largest event is the Tech Together conference with esteemed speakers, one-on-one resume workshopping, and networking with recruiters. For more information, follow our instagram @uowics</p>","Women in Computer Science (WiCS) is an association affiliated with the University of Oregon’s Computer & Information Science department. The WiCS mission is to encourage, empower, and excite women pursuing computer science and STEM-related careers to h...",Department Facilitated,Active,https://wicsuo.wixsite.com/uowics,,https://www.instagram.com/uowics/,,,CSI Registered Student Organizations
298754,Supporting the Advancement of Diversity in Design,STAnDD,STAnDD (Supporting the Advancement of Design) is an equity interest group at the University of Oregon. We strive to create a culture of inclusion by making current disparities understood and be part of a larger conversation about equity in architecture and design fields. We support the advancement of underrepresented groups and the promotion of diversity in these fields. We commit to the professional development of students in design professions and work to provide access for all students to attend conferences and events that will prepare them for their future careers.  ,STAnDD (Supporting the Advancement of Design) is an equity interest group at the University of Oregon. We strive to create a culture of inclusion by making current disparities understood and be part of a larger conversation about equity in architecture...,Department Facilitated,Inactive,,,,,,CSI Registered Student Organizations
298756,Ducks With Diabetes,DWD,"Ducks With Diabetes is the University of Oregon's club for Type 1 Diabetic students. We create a space for type ones to share experiences and support one another, as well as occasionally doing outreach into the community. ","Ducks With Diabetes is the University of Oregon's club for Type 1 Diabetic students. We create a space for type ones to share experiences and support one another, as well as occasionally doing outreach into the community. ",Independent Student Organization,Inactive,,,,,,CSI Registered Student Organizations
298757,Maker Club,UOMC,"<p>The Maker Club invites students of all experience levels to learn about hardware and software including: electronics, programming, and fabrication.</p>","The Maker Club invites students of all experience levels to learn about hardware and software including: electronics, programming, and fabrication.",Department Facilitated,Inactive,https://www.cs.uoregon.edu/groups/maker/,,,,,CSI Registered Student Organizations
298759,Bee Friendly Committee,BFC,"<p>The University of Oregon Bee Committee was founded to promote the Bee Campus USA initiative, of which the university is a certified affiliate. We intend to promote awareness on pollinators through campus and the surrounding community; with informational outreach, volunteering to expand pollinator-friendly patches on campus, and hosting awareness events and fundraisers.</p>","The University of Oregon Bee Committee was founded to promote awareness of pollinators through campus and the surrounding community through informational outreach, expanding pollinator-friendly patches on campus, and hosting events and fundraisers.",Independent Student Organization,Active,,,https://www.instagram.com/uobeefriendly/?hl=en,,,CSI Registered Student Organizations
298766,Anime Oregon,AO,"Anime Oregon is a UO club intended to form a community to discuss, show, promote, and enjoy anime. Anyone is free to become a member! \r\nMembers are encouraged to explore and share any related hobbies including: cosplay, art, media studies, writing, or simply appreciating anime. \r\n","Anime Oregon is a UO club intended to form a community to discuss, show, promote, and enjoy anime. Anyone is free to become a member! Members are encouraged to explore and share any related hobbies including: cosplay, art, media studies, writing, or si...",Hidden,Inactive,,,,,,CSI Registered Student Organizations
298770,Enthusiast Club,E!,"The Enthusiast Club is a place to share what you're enthusiastic about with a group of positive and enthusiastic people. We relax and get excited together about things we like, and there are also snacks.","The Enthusiast Club is a place to share what you're enthusiastic about with a group of positive and enthusiastic people. We relax and get excited together about things we like, and there are also snacks.",Hidden,Inactive,,,,,,CSI Registered Student Organizations
298771,Helping Out People Everywhere,HOPE,"<p>We focus on issues that not only face the city of Eugene, such as events focusing on drug take backs and mental health issues, but also work on our presence around the rest of the country by fund raising money to send people on life changing build trips with habitat for humanity. We also work with the local chapter here in Eugene. &nbsp;Feeding the homeless is also a very important part of our club. We typically send members to volunteer with Burrito Brigade downtown Eugene, and have partnered with various restaurants in the area to donate near-expired food to homeless shelters. Within 6 months we&rsquo;ve already donated $50,000+ worth of food! Contact us to learn more.</p>","We will focus on issues that not only face the city of Eugene, such as doing events like a drug take back event and an event that focuses on mental health.  We will also focus heavily on working with Habitat for Humanity.  We will work with the local c...",Independent Student Organization,Active,,,,,,CSI Registered Student Organizations
298773,Robotics Club,RBC,"This is a club about making robots, drones and something else about robotics. At the same time, we have a team in this club to attend the RoboMaster 2020, that is a World Cup of Robot, we will participate in various science and technology competitions on behalf of the school. ","This is a club about making robots, drones and something else about robotics. At the same time, we have a team in this club to attend the RoboMaster 2020, that is a World Cup of Robot, we will participate in various science and technology competitions ...",Independent Student Organization,Inactive,,,,,,CSI Registered Student Organizations
298782,Duck Nest Wellness Center,Duck Nest,"<p>Welcome to college. Welcome to new friends, new memories, and some of the best years of your life. But wait&mdash;that&rsquo;s not all. Welcome to midterms, late nights, dead weeks, and stress. Fear not fellow Duck&mdash;there&rsquo;s a place you can go to get away, to take a break, and maybe learn something too. A place where you are always invited. Welcome to the Duck Nest. Nestled in room 041 of the Erb Memorial Union, the Duck Nest wellness center can help you develop self-care and life-balance strategies related to stress, nutrition, physical activity, and general wellness.</p>\r\n<p>Want to get in touch, or join our team? Please email us peerhealth@uoregon.edu. Requests to join this page will not be approved.</p>","Welcome to college. Welcome to new friends, new memories, and some of the best years of your life. But wait—that’s not all. Welcome to midterms, late nights, dead weeks, and stress. Fear not fellow Duck—there’s a place you can go to get away, to take a...",Department Facilitated,Active,https://health.uoregon.edu/ducknest,http://facebook.com/ducknestwellnesscenter/,https://www.instagram.com/uo_ducknest/,http://twitter.com/uo_ducknest,,CSI Registered Student Organizations
298785,Operation Period,No,"<p>Operation Period&rsquo;s mission is to eliminate the stigma around menstrual health by offering support through physical and online educational services. Operation Period&rsquo;s vision is to create a world where menstruation doesn&rsquo;t hold a person back. It is essential to maintain a clear purpose and act in accordance with it. Therefore, the board, staff, and volunteers are committed to upholding and pursuing this goal to the best of their capacity. It is expected that Operation Period&rsquo;s ultimate goal be at the forefront of all of its operations and community relationships.&nbsp;</p>\r\n<p>&nbsp;</p>\r\n<p><strong>Our general meetings are every Thursday @ 6:00 in EMU room 012 and on Zoom!</strong></p>\r\n<p>Zoom link:&nbsp;<a href=""https://uoregon.zoom.us/j/96388137636?pwd=K3VOanlLQU1GcXp6dmplK1MzcmhMUT09"" target=""_blank"" rel=""noopener"">https://uoregon.zoom.us/j/96388137636?pwd=K3VOanlLQU1GcXp6dmplK1MzcmhMUT09</a></p>\r\n<p>Zoom ID: 963 8813 7636</p>\r\n<p>Zoom Password:&nbsp;427325</p>",Operation Period’s mission is to eliminate the stigma around menstrual health by offering support through physical and online educational services. Operation Period’s vision is to create a world where menstruation doesn’t hold a person back. It is esse...,Independent Student Organization,Active,,https://www.facebook.com/operationperioduo,https://www.instagram.com/operationperioduo/,,,CSI Registered Student Organizations
298800,Wishmakers on Campus Benefiting Make-A-Wish Foundation,Wishmakers on Campus,"Our goal is to grant, in full, child in Oregon's wish. In order to do so this club is to brainstorm different fundraising ideas and carry out events to raise money for Make-A-Wish Oregon. ","Our goal is to grant, in full, child in Oregon's wish. In order to do so this club is to brainstorm different fundraising ideas and carry out events to raise money for Make-A-Wish Oregon. ",Independent Student Organization,Inactive,,,,,,CSI Registered Student Organizations
298801,Gun Control in the United States,GCUS,"Our group will be focusing on the issue of gun control in the United States. The gross spike in mass shootings obligates the young citizens and future leaders of our country to research more closely, understand more fully, the past history and present forces which are not just molding the American political landscape, but also killing people. The aim of our OHC RIGS group will be three-fold: \r\n1) To educate ourselves most thoroughly on the history of gun control, with the intention of better understanding the forces of the present circumstances \r\n2) To use the education to take tangible, political action on a campus and community-level against gun violence. \r\n3) To relay the findings of our research to the larger University of Oregon student population and provide ways that these students, too, may take tangible, political action against a phenomenon which is taking human lives. ","Our group will be focusing on the issue of gun control in the United States. The gross spike in mass shootings obligates the young citizens and future leaders of our country to research more closely, understand more fully, the past history and present ...",Independent Student Organization,Inactive,,,,,,CSI Registered Student Organizations
298802,CSI Support,CSI Support,"<p>The CSI is an EMU program in the Division of Student Life.</p>\r\n<p>&nbsp;</p>\r\n<p>The Support Office facilitates the logistic aspects for the Student Activities Board.</p>\r\n<p>&nbsp;</p>\r\n<p>Purpose:</p>\r\n<p>The CSI&rsquo;s purpose is to help create a welcoming environment for all University of Oregon students to find community, create lasting memories, persist in school and gain experience for successful careers.</p>\r\n<p>&nbsp;</p>\r\n<p>Action:</p>\r\n<p>We do our part by supporting student organizations and activities that enliven UO traditions, engage students and connect the campus community. CSI creates and manages student organization support services that accelerate and simplify the event planning process. Services include: the Resource Center space, Supply Nest, Craft Room, Event Supply Exchange, student organization web-based management system, informational tools, storage cubbies, computer access and advising. Our staff support Student Activities Board teams and their free, safe, fun and inspirational events. We encourage student development through intentional trainings and interactions with student employees, leaders and volunteers. CSI develops reoccurring events, organizes crisis support events, assists with campus-wide event planning and collaborates with academic and other campus units.</p>",The CSI is an EMU program in the Division of Student Life.Purpose:The CSI’s purpose is to create a welcoming environment for all University of Oregon students.,Operational,Inactive,,,,,,CSI Registered Student Organizations
298806,EMU Board,EMU Board,"<p>The Erb Memorial Union Board is responsible for making general policy decisions and long-range plans for the operation of the EMU. The board allocates the EMU's multi-million dollar budget, assigns space for student groups and advises staff in the management of the EMU. The sixteen-member board consists of twelve students [seven elected in a campus-wide election and five direct appointments from either EMU programs or the ASUO], three faculty members appointed by the UO President and one EMU staff member elected by their peers. Being a member of the EMU Board provides students with the opportunity to work intimately with UO faculty and staff on a diverse set of issues, such as policy making, budgeting, and program development.</p>","The Erb Memorial Union Board is responsible for making general policy decisions and long-range plans for the operation of the EMU. The board allocates the EMU's multi-million dollar budget, assigns space for student groups and advises staff in the mana...",Department Facilitated,Active,https://emu.uoregon.edu/about/board,https://www.facebook.com/ErbMemorialUnion/,https://www.instagram.com/uoemu/,,,CSI Registered Student Organizations
298808,Hip Hop Dance Club at University of Oregon,Flock Rock Crew,"<p>We are a Hip-Hop dance organization that brings people from different communities and cultures together using breaking, popping, locking, and hip hop dance. Practice is in the rec in mat room 73/77 Monday Wednesday Friday from 9-10.&nbsp;</p>","We are a Hip-Hop dance organization that brings people from different communities and cultures together using breaking, popping, locking and hip hop dance.",Independent Student Organization,Active,,http://facebook.com/flockrockuo,,,,CSI Registered Student Organizations
298812,Society of Physics Graduate Students,SPGS,"The Society of Physics Graduate Students is a department sponsored group whose membership includes the graduate student body of the physics department. We host frequent events, including a Fall Picnic, Holiday Party, and a Talent Show, as well as weekly seminars and speakers. ","The Society of Physics Graduate Students is a department sponsored group whose membership includes the graduate student body of the physics department. We host frequent events, including a Fall Picnic, Holiday Party, and a Talent Show, as well as weekl...",Department Facilitated,Active,,,,,,CSI Registered Student Organizations
298815,Define American Chapter UO,DefineUO,"The Define American Chapter at the University of Oregon is a student-run organization that that uses the power of story to transcend politics and shift the conversation about immigration, identity, and citizenship in a changing America.","The Define American Chapter at the University of Oregon is a student-run organization that that uses the power of story to transcend politics and shift the conversation about immigration, identity, and citizenship in a changing America.",Hidden,Inactive,,,,,,CSI Registered Student Organizations
298823,Cubing Club at University of Oregon,CC@UO,"<p>We are a student club dedicated to pushing our limits of understanding and speed in the solving of Rubik's Cubes and other twisty puzzles. Whether you are interested in learning how to solve a Rubik's Cube, or you'd like to get into more advanced puzzles and speedsolving, we are open to it all!</p>","We are a student club dedicated to pushing our limits of understanding and speed in the solving of Rubik's Cubes and other twisty puzzles. Whether you are interested in learning how to solve a Rubik's Cube, or you'd like to get into more advanced puzzl...",Independent Student Organization,Active,,http://facebook.com/UOCube,https://instagram.com/cubingclub.uo?igshid=lngks4fw8rcq,,,CSI Registered Student Organizations
298824,The Synapse,UOS,"<p><span style=""font-weight: 400;"">The Synapse is a casual neuroscience discussion group! Each meeting, we share articles and interesting tidbits regarding an overarching neuroscience theme to inspire curiosity and expand general knowledge into this underrated field with great potential. Those topics include interesting and exciting new neuroscience research articles and the invitation to bring something to the table is extended to all, but is not a requirement! This club's arms are open to all and we actively welcome individuals of all academic backgrounds! </span></p>","The Synapse is a neuroscience research analysis discussion group! Each meeting, we go over some interesting and exciting new neuroscience research articles, discuss the potential applications of these discoveries, and relate the research to futuristic ...",Independent Student Organization,Active,,,,,,CSI Registered Student Organizations
298827,SKY@UO,SKY@UO,"<p>SKY@UO supports individual and campus community happiness, social connection, and resilience so that students can achieve personal and professional success as compassionate and service-minded leaders of tomorrow.</p>","SKY@UO supports individual and campus community happiness, social connection, and resilience so that students can achieve personal and professional success as compassionate and service-minded leaders of tomorrow. ",Independent Student Organization,Inactive,,http://facebook.com/SKYatUO,https://www.instagram.com/skyatuo/,,,CSI Registered Student Organizations
298831,Ducks for Israel,D4I,"<p>Pro-Israel University of Oregon students engaging in dialogue and discussion about current events happening affecting Israel in the Middle East, U.S. and on campus.</p>","Pro-Israel University of Oregon students engaging in dialogue and discussion about current events happening affecting Israel in the Middle East, U.S. and on campus.",Independent Student Organization,Active,,http://facebook.com/DucksForIsrael,,,,CSI Registered Student Organizations
298836,Transfer Club at the University of Oregon,TC,"<p>This freshly revived club has two main goals:</p>\r\n<p>1) To be an information hub for sharing and collecting resources and opportunities we transfer students might otherwise not know about, both on and off campus.</p>\r\n<p>2) Serve as a home place for all of us transfer students to get to know each other, and strategize on how to best make use of our limited time on campus.</p>\r\n<p><em>All levels of participation or non-participation are encouraged as suits your particular needs and schedule.</em></p>\r\n<p>&nbsp;</p>\r\n<p>https://linktr.ee/uotransfers</p>\r\n<p>&nbsp;</p>","Make the most of your short time on campus! Get involved with other fellow transfer students; meet new friends, gather resources and find new opportunities!",Independent Student Organization,Active,https://linktr.ee/uotransfers,,,http://twitter.com/@transfersclub,,CSI Registered Student Organizations
298839,Anti-Human Trafficking Club,AHTC,"<p>The purpose of this organization is to advocate, educate and put an end to human trafficking. Human trafficking is a very prevalent and horrific crime that occurs all over the world and impacts the lives of millions of people. There is no better time to combat this crime than now, and no better place to work on it than the UO.&nbsp;</p>","The purpose of this organization is to advocate, educate and put an end to human trafficking. Human trafficking is a form of modern day slavery that impacts the lives of millions of people. There is no better time to combat this crime than now, and no ...",Independent Student Organization,Active,,,https://www.instagram.com/UOAHTC/,,,CSI Registered Student Organizations
