Organization Id,Organization Name,Short Name,Organization Description,Organization Summary,Organization Type,Status,Website Url,Facebook Url,Instagram Url,Twitter Url,YouTube Channel Url,Parent Organization Name
298416,Multicultural Center,MCC,"The Multicultural Center, based on the EMU student union hall, ideally aspired to be a center “where all students would be welcomed to meet, plan, and help with educating the community about diversity.” The student-funded MCC was approved in the mid-1990s and became the catalyst for a series of changes. The MCC is a hub of activism, connecting students of all races and backgrounds, especially by listserve and computer bulletin boards to encourage collaboration around diversity programming and education. The MCC has sponsored annual conferences on diversity, featuring renown keynote speakers including historians Howard Zinn (author of People’s History of the United States), professors Angela Davids, poet/playwright Amiri Baraka, actor edward James Olmos, activist Bobby Seale, Father Roy Bourgeois, global performance artist Guillermo Gomez-Pena, Yolando King (daughter of MLK), the Reverend Jesse Jackson, Adelina Anthony, Elaine Brown, Athen’s Boys Choir, among Many others. The MCC accommodates any meetings of student unions, educational and cultural workshops, guest speakers and artists, art displays, open mic spoken word events, hip hop concerts, etc. The MCC also houses a resource library of books and videos, and a small computer lab for students to work on academic and union projects. The MCC provides potential coalition space for disparate groups in one physical location, encouraging dialogue and cooperation towards achieving common goals, as well as union general meeting space.\r\n\r\n\r\nA significant result of the struggle in 1999 against a campus hate crime against women of color, and part of the overall effort to achieve more equity and a climate of fairness and safety on campus, was the initial project of 10 student interns who researched and formulated a new diversity initiative plan. The diversity interns defined the concept of diversity in a broad inclusive way, combining gender and ethnic constituents’ concerns and derhands:\r\n\r\n“It (diversity) means recognizing our individual differences. These can be along the dimensions of race, ethnicity, gender, sexual orientation, socio0economic status, age, physical abilities, religious beliefs, political beliefs, or other ideologies. It is the exploration of these differences in a safe, positive, and nurturing environment moving beyond simple tolerance to embracing and celebrating the rich dimensions of diversity contained in each individual.” (from original U.O. diversity internship web site)\r\n\r\nSince then, the student staff, student volunteer base and faculty/staff allies of the MCC have taken up numerous campaigns to improve the climate of the campus, including the effort to rid the campus of its past contractual affiliations with hate radio; to stop institutional efforts to cut back staff at the Office of Multicultural Academic Success; and to resist culturally incompetent assaults by EMU administrators on the MCC and its staff; as well as to coalition with faculty and the ASUO to departmentalize Ethnic Studeies and Women’s Studies etc.\r\n\r\n“In the next millennium, the University of Oregon will continue to change. Students of color have become agents of change, altering and adding value to educational policies, changing the direction of curriculum; and calling attention to an unfriendly campus climate that has too often tolerated racism, (sexism, homophobia, and other oppressive behaviors.) Working together in coalitions as well as in separate groups, students of color (and other underrepresented groups) have been instrumental in pressing for progress. By questioning and challenging the university’s academic and social life, students have advocated for improvements that build a safe and culturally pluralistic learning environment.”\r\n\r\n– excerpt from the book Making a Difference? University Students of Color Speak Out, (chapter 6) by Donna Wong and Julia Lesage (Littlefield Publishers)\r\n\r\n———————————————————–\r\n\r\nHistorical Summary\r\n\r\nThe Multicultural Center was founded, sustained, and developed by student activists of diverse backgrounds and cultures, resulting from historically recent efforts to create a more inclusive and diverse campus community since 1995. The MCC was born and developed out of the campaign for a multicultural curriculum requirement that would encourage scholarship, a more tolerant respectful campus community, and a more accurate, truthful and inclusive pedagogy to prepare students for an increasingly diverse world. It was formed to fill the needs of students of color and other marginalized students that were not sufficiently addressed by the university’s other programs and services.","The Multicultural Center, based on the EMU student union hall, ideally aspired to be a center “where all students would be welcomed to meet, plan, and help with educating the community about diversity.” The student-funded MCC was approved in the mid-19...",Hidden,Inactive,,,,,,Student Life
298422,Get Involved Network,GIN,,,Department/Non-Student Org,Active,,,,,,Student Life
298438,Queer Ally Coalition,QAC,"The Queer Ally Coalition (QAC) seeks to reduce homophobia, heterosexism, and gender bias on the University of Oregon campus and create an atmosphere of understanding and acceptance for all members of our community inclusive of all sexual orientations and gender identities. In addition to visibly identifying members of our community who are willing to be acknowledged as allies for gay, lesbian, bisexual, transgender, and questioning students, faculty, and staff, we organize training programs and provide ongoing opportunities for dialogue to expand our understanding of the issues in our campus community.\r\nThe Queer Ally Coalition is open to all members of the University of Oregon community who wish to learn more about lesbian, gay, bisexual, transgender, queer (LGBTQ) and ally issues and support LGBTQIA+ individuals.","The Queer Ally Coalition (QAC) seeks to reduce homophobia, heterosexism, and gender bias on the University of Oregon campus and create an atmosphere of understanding and acceptance for all members of our community inclusive of all sexual orientations a...",Department/Non-Student Org,Active,,,,,,Student Life
298454,Residence Life - Student Leader Resources,RL - SLR,"<p>Resources for student leaders who serve in the residence halls, family housing and university apartments, and the housing service centers.</p>","Resources for student leaders who serve in the residence halls, family housing and university apartments, and the housing service centers.",Closed Branch Organizations,Inactive,,,,,,Student Life
298466,UO Career Center,UO Career,"The Career Center exists to provide career and job search services and resources to UO students and alumni. Our mission is to help you develop long-term career goals and strategies, facilitate self-exploration and discovery, connect with potential employers, and empower and challenge you to fulfill your potential. We look forward to serving as your advocate as you pursue an inspired and fulfilling future. \r\n\r\nThe UO Career Center is a part of the Division of Student Life and has offices in Hendricks Hall on the UO campus and in the White Stag Block at the University of Oregon in Portland.","The Career Center exists to provide career and job search services and resources to UO students and alumni. Our mission is to help you develop long-term career goals and strategies, facilitate self-exploration and discovery, connect with potential empl...",Department/Non-Student Org,Active,,http://facebook.com/uocareercenter,,http://twitter.com/uocareercenter,,Student Life
298488,Lundquist College Undergraduate Programs,Undergraduate Programs,"Lundquist College Undergraduate Programs provides quality services to undergraduate business students including academic advising for Pre-Business, Business Administration, and Accounting majors, tutoring in business courses through the Braddock Tutoring Center, living and learning opportunities in the College of Business Residential Community, and a high performance community for minority business students through the Building Business Leaders and CEO Network programs, and much more. ","Lundquist College Undergraduate Programs provides quality services to undergraduate business students including academic advising for Pre-Business, Business Administration, and Accounting majors, tutoring in business courses through the Braddock Tutori...",Closed Branch Organizations,Inactive,,,,,,Student Life
298503,Student Sustainability Center,Student Sustainability Center,"The Student Sustainability Center (SSC) is a program of the Erb Memorial Union. The Student Sustainability Center is a collaborative space for student-led initiatives that foster and support the simultaneous pursuit of  human equity, environmental vitality and economic well-being for the present and future. Through collaborative efforts, we hope to help students develop the skills, strategies, and networks necessary to achieve their vision for society.","The Student Sustainability Center (SSC) is a program of the Erb Memorial Union. The Student Sustainability Center is a collaborative space for student-led initiatives that foster and support the simultaneous pursuit of  human equity, environmental vita...",Department/Non-Student Org,Active,,http://facebook.com/studentsustainabilitycenter,,http://twitter.com/uossc,,Student Life
298555,Mills International Center,MIC,"Meet the World Here!\r\n\r\nWe are a lounge, resource center, event venue, and a home away from home! We are a great place to spend time if you enjoy traveling and good company, are an international student, have been or will go on study abroad, or simply are looking for a comfy couch. \r\n\r\nWe have a lending library full of travel and culture guides (books and DVDs), cookbooks, and travel narratives, as well as magazines and CDs from around the world. And the Mills is never a dull place to be with its popularity as a place to host events. Some examples of past events are art exhibitions, movie nights, and study abroad information sessions. \r\n\r\nMills Center is a great place to make new friends from all over the world. No matter what you may be looking for, the Mills International Center has something to offer you.","Meet the World Here!We are a lounge, resource center, event venue, and a home away from home! We are a great place to spend time if you enjoy traveling and good company, are an international student, have been or will go on study abroad, or simply are ...",Department/Non-Student Org,Active,,http://facebook.com/Facebook.com/UOMills,,http://twitter.com/Twitter.com/UOMills,,Student Life
298564,LGBTESSP,LGTESSP,"The mission of the Lesbian, Gay, Bisexual, Transgender Education and Support Services (LGBTESS) is to provide education and support that enhances the academic and personal growth of lesbian, gay, bisexual, transgender, queer, questioning, intersex, asexual, aromantic, agender and ally students, faculty, staff, and visiting community members while assisting in the creation of a campus climate that is free from homophobia, transphobia, heterosexism, and binarygender bias and allows unrestricted access and full involvement for our campus community.","The mission of the Lesbian, Gay, Bisexual, Transgender Education and Support Services (LGBTESS) is to provide education and support that enhances the academic and personal growth of lesbian, gay, bisexual, transgender, queer, questioning, intersex, ase...",Department/Non-Student Org,Active,,,,,,Student Life
298599,Entrepreneurship at UO,Entrepreneurship,The OrgSync destination for all things Entrepreneurship and Innovation at the University of Oregon. ,The OrgSync destination for all things Entrepreneurship and Innovation at the University of Oregon. ,Closed Branch Organizations,Inactive,,,,,,Student Life
298614,UCC Student Advisory Board,UCC SAB,"The University Counseling Center Student Advisory Board (SAB) helps the UCC optimize its services through student feedback and innovation. In addition to direct feedback, SAB also supports collaboration between the Division of Student Life and other mental health and wellness organizations at the UO—such as student groups—and diverse student populations. SAB helps to distribute accurate and relevant information about available personal support resources and services in the UO community. Being a member of SAB cultivates leadership skills in UO students who are interested in mental wellness and encourages student advocacy for campus mental health and wellness. ","The University Counseling Center Student Advisory Board (SAB) helps the UCC optimize its services through student feedback and innovation. In addition to direct feedback, SAB also supports collaboration between the Division of Student Life and other me...",Closed Branch Organizations,Inactive,,,,,,Student Life
298618,Global Education Oregon (GEO) Study Abroad,GEO,"<p>At Global Education Oregon, we create pathways to international, experiential learning for students, faculty, and university partners. Founded on the belief that international engagement is integral to developing global citizens, we: Prepare students for a 21st century workforce, creating exceptional academic and professional development opportunities abroad; Connect faculty to cross-cultural perspectives that enhance their teaching and research; Provide institutional partners with a personalized, progressive approach to international programming and collaboration.</p>\r\n<p>Interested in joining our Study Abroad Club? Join the Study Abroad Club for professional development opportunities like study abroad ambassador programs on campus and leadership roles within the club.&nbsp;Open to GEO Alumni and students still considering or actively planning to go on a study abroad experience are all welcome to join the Club!&nbsp;</p>\r\n<p>Register here:&nbsp;https://app.smartsheet.com/b/form/e54e415910024b3589e91746aaa3c51c&nbsp;</p>","At Global Education Oregon, we create pathways to international, experiential learning for students, faculty, and university partners.  ",Department/Non-Student Org,Active,https://geo.uoregon.edu/,http://facebook.com/GEOAbroad,https://www.instagram.com/geoabroad/,http://twitter.com/GEOabroad,https://www.youtube.com/channel/UCy81IQekcaZVCSfdt5pCoSQ,Student Life
298620,Oregon Consulting Group,OCG,"The Oregon Consulting Group (OCG) is a professionally managed, student-run consulting organization housed in the Lundquist College of Business at the University of Oregon. OCG works with companies and nonprofit organizations to deliver excellent quality research, analysis, insights, strategies and business plans at a fraction of the cost of a traditional consultancy.\r\n\r\nFounded in 2014, its primary purpose is to provide student consultants an opportunity to gain mastery of their classroom studies through intensive experiential learning. OCG serves companies and nonprofits on a wide range of consulting projects, operating under the guidance of a professional director and drawing on the expertise of Lundquist College of Business faculty and research resources to provide clients with a professional deliverable from student consulting teams.\r\n\r\nEvery project is led by a dedicated project manager and a team of our well-trained student consultants. Each project is managed in a professional manner with a clear statement of work and weekly status update meetings. The OCG consulting service offerings for market analysis, financial analysis, and business strategy are often combined in our client projects.","The Oregon Consulting Group (OCG) is a professionally managed, student-run consulting organization housed in the Lundquist College of Business at the University of Oregon. OCG works with companies and nonprofit organizations to deliver excellent qualit...",Closed Branch Organizations,Inactive,,,,,,Student Life
298655,Society for International Security,SIS,,,Closed Branch Organizations,Active,,,,,,Student Life
298663,Hamilton West Hall,HWH,,,Closed Branch Organizations,Inactive,,,,,,Student Life
298682,Kalapuya Ilihi Hall,KIH,,,Closed Branch Organizations,Inactive,,http://facebook.com/UOKalapuyaIlihi/,,http://twitter.com/uohousing,,Student Life
298684,Multicultural Center (MCC),MCC,,,Department/Non-Student Org,Active,,,,,,Student Life
298691,EMU Outdoor Program,OP,"<p>The OP Cooperative was born in 1967 when a few UO students began posting notes to share rides and gear for outdoor adventures. Since then the OP has grown into a thriving program of trips, events, gear rentals, resources, as well as a bike events, loans, and self-service maintenance shop.</p>","The OP Cooperative was born in 1967 when a few UO students began posting notes to share rides and gear for outdoor adventures. Since then the OP has grown into a thriving program of trips, events, gear rentals, resources, as well as a bike events, loan...",Department/Non-Student Org,Active,,,,,,Student Life
298699,Riley Hall,RH,,,Closed Branch Organizations,Inactive,,,,,,Student Life
298700,Living-Learning Center,LLC,,,Closed Branch Organizations,Inactive,,,,,,Student Life
298704,Walton North Hall,WNH,,,Closed Branch Organizations,Inactive,,,,,,Student Life
298719,Walton South Hall,WSH,,,Closed Branch Organizations,Inactive,,,,,,Student Life
298734,Center for Sustainable Business Practices | MBA,CSBP MBA,,,Closed Branch Organizations,Inactive,,http://facebook.com/CSBP.UO,,http://twitter.com/oregongreenmba,,Student Life
298738,Office of Major Student Events,Major Student Events,"<p>We enrich the student experience by providing exceptional, inclusive, and iconic student-centered events and by creating opportunities for meaningful engagement, tradition building, and exploration of the university experience. We have a responsibility to be a catalyst for inspiring university pride and to excite our students to be active, involved and engaged members of the UO community.</p>","We enrich the student experience by providing exceptional, inclusive, and iconic student-centered events and by creating opportunities for meaningful engagement, tradition building, and exploration of the university experience. ",Hidden,Active,,,,,,Student Life
298740,Undergraduate Research Symposium,URS,"Participation in the Undergraduate Research Symposium enables undergraduates to share their ideas, discoveries, and artistic expression with campus and the local community. The symposium invites students to select their preferred style of presentation that best accommodates their projects. Held in the EMU in the style of an academic conference, the symposium includes poster sessions, oral presentations and exhibition space for performing and fine arts.\r\n\r\nFor general questions about the Undergraduate Research Symposium, information about tutorial support and preparatory workshops, please write to ugresearch@uoregon.edu. For information from peers about research and how to get involved, please write to ASURE at asure@uoregon.edu. ","Participation in the Undergraduate Research Symposium enables undergraduates to share their ideas, discoveries, and artistic expression with campus and the local community. The symposium invites students to select their preferred style of presentation ...",Closed Branch Organizations,Inactive,,,,,,Student Life
298741,Residence Hall Association,RHA,"<p>RHA is the second largest student governing body at the University of Oregon and represents all students who reside in the Residence Halls. RHA makes policy recommendations to University Housing, partners with student governing bodies and groups, and connects the University of Oregon to other students through national conferences. Additionally, RHA provides leadership and programming in the Residence Halls in order to make them a more engaging and exciting place to live. If there is any issue you have with University Housing, or you just want to get involved with where you live, RHA is the place to do it.</p>\r\n<p>If you have any funding or legislative requests, please submit them through our new website:&nbsp;https://blogs.uoregon.edu/residencehallassociation/</p>",RHA is the second largest student governing body at the University of Oregon and represents all students who reside in the Residence Halls.,Default,Active,https://blogs.uoregon.edu/residencehallassociation/,,http://instagram.com/UORHA,http://twitter.com/UORHA,,Student Life
298742,National Residence Hall Honorary,NRHH,"<p>We are the University of Oregon's chapter of the National Residence Hall Honorary! We are an organization dedicated to service and recognition, and we hold events around campus all year long. Anyone is able to join our meetings and help us spread the diamond love.</p>","We are the University of Oregon's chapter of the National Residence Hall Honorary! We are an organization dedicated to service and recognition, and we hold events around campus all year long. Anyone is able to join our meetings and help us spread the d...",Default,Active,,,,,,Student Life
298746,Beta Alpha Psi,BAP,"Founded in 1919, Beta Alpha Psi is an honor organization for financial information students and professionals. There are over 300 chapters on college and university campuses with over 300,000 members initiated since Beta Alpha Psi's formation.\r\nPurpose\r\n\r\nThe purpose of Beta Alpha Psi is to:\r\n\r\n    Recognize outstanding academic achievements in the field of accounting, finance, and information systems;\r\n    Promote the study and practice of professional fields related to these disciplines;\r\n    Provide opportunities for self-development and association among members and practicing financial professionals;\r\n    Encourage a sense of ethical, social, and public responsibilities\r\n\r\nVISION\r\n\r\nBeta Alpha Psi will shape the financial and business information professions by developing members into ethical, professional, and confident leaders.\r\n\r\nMISSION\r\n\r\nThe mission of Beta Alpha Psi, the premier international honor and service organization for financial and business information students and professionals, is to inspire and support excellence by:\r\n\r\n    Encouraging the study and practice of accountancy, finance, and information systems;\r\n    Providing opportunities for service, professional development, and interaction among members and financial professionals; and\r\n    fostering lifelong ethical, social, and public responsibilities.","Founded in 1919, Beta Alpha Psi is an honor organization for financial information students and professionals. There are over 300 chapters on college and university campuses with over 300,000 members initiated since Beta Alpha Psi's formation.PurposeTh...",Closed Branch Organizations,Inactive,,http://facebook.com/uobap,,http://twitter.com/uobap,,Student Life
298747,Student Life Emerging Leaders,Emerging Leaders,"The Student Life Emerging Leaders Intern Program offers structured and supervised experiential-learning opportunities that provide you with practical experience in the field of student affairs—or as we like to call it Student Life. All internships include learning objectives, observation, reflection, evaluation, and assessment. ",The Student Life Emerging Leaders Intern Program offers structured and supervised experiential-learning opportunities that provide you with practical experience in the field of student affairs—or as we like to call it Student Life. All internships incl...,Hidden,Active,,,,,,Student Life
298748,All Student-Athletes,All SA's,All varsity student-athletes affiliated with University of Oregon Athletics. ,All varsity student-athletes affiliated with University of Oregon Athletics. ,Closed Branch Organizations,Inactive,,,,,,Student Life
298751,Oregon Law - Academic Affairs,Academic Affairs,,,Closed Branch Organizations,Inactive,,,,,,Student Life
298752,Student-Athlete Advisory Committee,SAAC,,,Closed Branch Organizations,Inactive,,,,,,Student Life
298753,Lundquist Center for Entrepreneurship | MBA,LCE MBA,,,Closed Branch Organizations,Inactive,,,,,,Student Life
298755,Oregon Law - Information Technology,LawIT,"The LawIT team provides a full array of computing services to the UO Law School community. These services include administrative IT management, a full-service help desk, classroom technology support, website and online web portal, technology training, and support for special events.","The LawIT team provides a full array of computing services to the UO Law School community. These services include administrative IT management, a full-service help desk, classroom technology support, website and online web portal, technology training, ...",Closed Branch Organizations,Inactive,,,,,,Student Life
