Organization Id,Organization Name,Short Name,Organization Description,Organization Summary,Organization Type,Status,Website Url,Facebook Url,Instagram Url,Twitter Url,YouTube Channel Url,Parent Organization Name
298621,Art History Student Association,AHSA,"<p>The University of Oregon Art History Student Association facilitates and promotes educational and professional development opportunities for students interested in the history of the visual arts, regardless of major field of study. We are affiliated with the Art History Department at the University of Oregon. Our goals are to provide exposure to art through trips to exhibits and monuments at local and regional art institutions, as well as hosting an annual graduate research symposium and keynote lecture delivered by a prominent art historian. We will serve as a forum to discuss local art, aid students in developing curatorial skills through the acquisition and exhibition of University of Oregon student art, and advocate for art history student interests within the Department of Art History, the College of Design, and campus-wide.</p>","The University of Oregon Art History Student Association facilitates and promotes educational and professional development opportunities for students interested in the history of the visual arts, regardless of major field of study. We are affiliated wi...",Tier 3 Student Organization,Active,https://arthistoryassociationoregon.wordpress.com/,https://www.facebook.com/UOregonAHSA/,https://www.instagram.com/uoregon.ahsa/,http://twitter.com/uo_aha,,ASUO Student Organizations
298622,South Asian Cultural Alliance (formerly SIS) ,SIS,"<p>Founded in 1999, UO SACA (South Asian Cutural Alliance) is a student-led organization that aims to promote the many cultures that exist within South Asia. As a highly underrepresented group on campus, we seek to provide a safe, inclusive space for South Asian international students, South Asian-American students, and for anyone who is interested in our culture. SACA is welcome to all.</p>","The Students of the Indian Subcontinent is a student group at the University of Oregon. The goal of the group is to: 1) Promote the many cultures of the Indian subcontinent 2) Create a network of people who are, in any way, interested in the subcontinent",Tier 4 Student Organization,Active,https://pages.uoregon.edu/sis/,https://www.facebook.com/uoregonsaca/,https://www.instagram.com/uoregonsaca/,,,ASUO Student Organizations
298623,Students for Global Health,SGH,"<p class=""x_x_x_x_x_x_x_x_x_x_x_p1""><span class=""x_x_x_x_x_x_x_x_x_x_x_s1"">We're a student group devoted to social justice and global health equity. We work particularly against diseases that most adversely affect people living in poverty and the conditions that make them vulnerable by raising awareness and funds on campus and in the community. We are a chapter of Partners in Health Engage, which is a section of Partners in Health dedicated to young professionals and students. PIH's motto is ""Health is a Human Right,"" and we are on board with this ideal. Our group meets to learn about and discuss issues and solutions related to global and public health, as well as to plan future events and coordinate volunteer opportunities. Our 2022 meetings will take place weekly. All majors and interests are welcome!</span></p>\r\n<p class=""x_x_x_x_x_x_x_x_x_x_x_p1""><span class=""x_x_x_x_x_x_x_x_x_x_x_s1"">Join our email list:&nbsp;https://forms.gle/ipRTNX6JchXAaUch7&nbsp;</span></p>","We're a student group devoted to social justice and global health equity, and are a Partners In Health Chapter. Our meetings take place weekly on Tuesdays from 6 - 7 pm in Straub 252. All majors and interests are welcome!",Tier 2 Student Organization,Active,https://www.uoglobalhealth.com/,http://facebook.com/uostudentsforglobalhealth,https://www.instagram.com/uoglobalhealth/?hl=en,,,ASUO Student Organizations
298624,Latinx Law Student Association,LLSA,<p>The Latinx Law Student Association is committed to providing a forum for cultural exchange and the advancement of a diverse legal professional field.</p>,The Latinx Law Student Association is committed to providing a forum for cultural exchange and the advancement of a diverse legal professional field.,Tier 3 Student Organization,Active,,https://www.facebook.com/LLSA.UofO/?__tn__=kC-R&eid=ARATLmwbNLlIqOrt3YhbCqCg-O4wrEgWLy44YLmn895r8Nw68Sqx6iKQiYLT0RWCul_sfOGyZZih8EdV&hc_ref=ARTtX56M9gJMWDpT6EXhQxteCBHzV_WRhr1oBjm1HnBZHgBzuShnyJLyBlZP47Ou8Pk&fref=nf&__xts__[0]=68.ARDoX-JNi_iWRDUm2M1EMYJG1NKTLfSvoD2ckYeimEyuEzHdUXDUnbpTdYAbOI3IZoKVSJpxW0K94LerotUdl8JQ2ifoHyUD5XvEuavtv0gwB_2eytf0O3i0hq27IQyHO-LLaMflPH8xBvt2PifhqR4VgIzcdKjzKskocxmz_DLkDRj2ELFLTHozTYYfhqSa1BzYZNwORvIrq21SZeC6LXFWpZ-ecUPLh1hoPKnRkjLL2QlQUBhZwx_hzXwvnhg7Ey4qU4QZZmdsK-Fj36c1J42zSst-M4O9DlBZgwdHDbZATU7K33mKvwmY3ptyFm4uiB4KSBDqbLJClL9LD9RYvuzoWXF7swkYNuYZvqn2ATB5OCUoUPY8MoE,,http://twitter.com/LALSA_UO,,ASUO Student Organizations
298626,Ad Club,Ad Society,"<p>Ad Club is a student-run organization that assists students with a passion for advertising, as they become young professionals. We hold weekly meetings, conduct agency field trips, offer networking support and lead workshops to assist students as they expand their understanding of the advertising industry.</p>","Ad Club is a student-run organization that assists students with a passion for advertising, as they become young professionals. We hold weekly meetings, conduct agency field trips, offer networking support and lead workshops to assist students as they ...",Tier 2 Student Organization,Active,,,,,,ASUO Student Organizations
298627,Student Org Advisor Center,SOAC,,,Hidden,Frozen,,,,,,ASUO Student Organizations
298628,Black Male Alliance,BMA,"<p>The Black Male Alliance is a community of Black men at the University of Oregon, comprised of students, staff, faculty, and alumni. This community exists to be a space to support the general well-being of Black men at UO through social events, academic support, and leadership opportunities. We meet on a weekly and host a space for open dialogue, community conversations, professional development, and the opportunity to cultivate fellowship.&nbsp;</p>","The Black Male Alliance is a community of Black men at the University of Oregon, comprised of students, staff, faculty and alumni. This community exists to be a space to support the general well-being of black men at UO through deepening our cultural a...",Tier 3 Student Organization,Active,,http://facebook.com//uobma/,https://www.instagram.com/uo_bma/?hl=en,http://twitter.com//UO_BMA,,ASUO Student Organizations
298629,Sigma Tau Delta,ATP,"<p>Sigma Tau Delta, International English Honor Society, promotes interest in literature and the English language on local campuses and their surrounding communities, fostering this discipline of English in all its aspects, including creative and critical writing. Our desire to establish a distinguished community of scholars of English and related disciplines to support literacy and literature on campus and in the surrounding community motivated us to bring Sigma Tau Delta to the University of Oregon.</p>","Sigma Tau Delta, International English Honor Society, promotes interest in literature and the English language on local campuses and their surrounding communities, fostering this discipline of English in all its aspects, including creative and critical..",Tier 2 Student Organization,Active,http://uosigmataudelta.weebly.com/,,,,,ASUO Student Organizations
298630,Asian Pacific American Law Student Association,APALSA,"<p>The Asian Pacific American Law Student Association (&ldquo;APALSA&rdquo;) is a law student organization that functions as a professional and academic resource for APA students and allies. This group aims to bring attention to APA issues, especially in and to the legal community.&nbsp;</p>","We are a law student group dedicated to bringing attention to Asian Pacific American issues, especially in and to the legal community.",Tier 3 Student Organization,Active,,https://www.facebook.com/UOAPALSA/,https://www.instagram.com/uoapalsa/,,,ASUO Student Organizations
298633,UO Muxeres,Muxeres,"<p>The Muxeres ( formerly known as Mujeres) group was as a sub-group of MEChA, created in 1995, by the female members within the organization to act as a support for Latinas and Chicanx on campus. Muxeres has recently become its own ASUO recognized organization. Part of the ideology of the Muxeres group is to recognize that the Latinx voice is a powerful political voice that has historically resisted the dualistic oppression of racism and sexism through education, unity, and support from community members. The main goal of Muxeres is to create a safe environment for its members to discuss issues that affect Latinx students on campus, within the Chicanx/Latinx community; and on a societal level. The group is facilitated by an elected student coordinator/ Internal Director and is open to all students, as well as community members, staff and faculty.</p>","The Muxeres ( formerly known as Mujeres) group was as a sub-group of MEChA, created in 1995, by the female members within the organization to act as a support for Latinas and Chicanx on campus. Muxeres has recently become its own ASUO recognized organi...",Tier 3 Student Organization,Active,,https://www.facebook.com/uomuxeres/,https://www.instagram.com/uomuxeres/?hl=en,,,ASUO Student Organizations
298634,University of Oregon Undergraduate Law Association,UOULA,"<p><span style=""color: #000000;""><span style=""font-size: medium;"">The Undergraduate Law Association at the University of Oregon is open to all majors who are interested in pursuing knowledge about the legal industry and law school. We will invite a variety of speakers to touch upon all aspects of the field from LSAT prep and law school life, to court cases and the lifestyles of practicing lawyers. The goal of the association is to guide and enrich students as they delve deeper into the field of law.</span></span></p>",The Undergraduate Law Association at the University of Oregon is open to all majors who are interested in pursuing knowledge about the legal industry and law school.,Tier 1 Student Organization,Active,https://www.uoula.org/,,,,,ASUO Student Organizations
298637,Radical Organizing and Activism Resource (ROAR) Center ,ROAR,"<p>The ROAR Center is a resource center for social and environmental activists. Inspired by a student-led class called &ldquo;Can Man Survive?&rdquo; in 1970 (the highest-enrolled class in the history of the University of Oregon) the Survival Center focused on empowering student voices to demand change. Over the course of 40 years, Survival Center has transformed into an entirely student-run organization (members fired the paid staff in the 80s and continue make consensus-based decisions to this day), that organizes events and campaigns covering a large array of issues. While the Survival Center still holds to its environmental roots members and co-directors recognize that the struggle to end the exploitation of our earth is inherently connected to the struggle to liberate ourselves from a system that wants healthy profit rather than healthy people. We are committed to fight against capitalism, imperialism, racism, sexism, homophobia and all forms of greed, ignorance, and domination.</p>","The ROAR Center is resource space where individuals can build community, attend meetings, borrow books from our library, engage in direct actions and campaigns planned for the year, define their radical politics, and get to know other like-minded folks!",Tier 4 Student Organization,Active,,http://facebook.com/Roar.center/,https://instagram.com/roarcenter?utm_medium=copy_link,,,ASUO Student Organizations
298639,Students for Criminal Justice,UO CJN,"<p>The UO Students for Criminal Justice strives to engage people around issues of incarceration and the legal system, as a whole, toward the improvement of our society.</p>","The UO Students for Criminal Justice strives to engage people around issues of incarceration and the legal system, as a whole, toward the improvement of our society.",Tier 1 Student Organization,Active,,,,,,ASUO Student Organizations
298640,Arab Student Union,ASU,"<p>The Arab Student Union is devoted to sponsoring cultural awareness, competence, and education by spreading the diversity and richness of the cultures, histories, and traditions of the people of the Arab nations. Through social and cultural events, we aim to create a more accurate picture of Arabs, and develop a close-knit community to provide a safe and comfortable environment for Arabs, Arab-Americans, and anyone interested in supporting us. We hope that by bringing people of Arab, as well as non-Arab descent, we can create a family atmosphere where we all can grow in knowledge of each other and ourselves. We encourage to you contact us and offer your ideas about activities, you would like to see, to aid in our mission of a more active, aware, and socially responsible university and community.</p>","The Arab Student Union is devoted to sponsoring cultural awareness, competence, and education by spreading the diversity and richness of the cultures, histories, and traditions of the people of the Arab nations. Through social and cultural events, we a...",Tier 4 Student Organization,Active,,http://facebook.com/uoasuofficial,,http://twitter.com/uoasuofficial,,ASUO Student Organizations
298641,American Marketing Association,AMA,"<p>The UO AMA is a student-run marketing organization that aims to connect students with professional marketers and offer insight into the marketing profession through the avenues of solid leadership, strong communications, real-world marketing experience, and charitable involvement. The American Marketing Association (AMA) is the world&rsquo;s largest and most comprehensive professional society for marketers, with nearly 45,000 members in 100 countries with 250 collegiate chapters. Our chapter offers a combination of campus events, professional guest speakers, and interactive site visits every term. Members also have the chance to gain great camaraderie and strengthen their leadership skills. The UO AMA is open to all students, regardless of major, who are interested in marketing. We&nbsp;meet every other Wednesday (Weeks 3,5,7,9) virtually through Zoom.</p>","The UO AMA is a student-run marketing organization that aims to connect students with professional marketers and offer insight into the marketing profession through the avenues of solid leadership, strong communications, real-world marketing experience.",Tier 3 Student Organization,Active,,,https://www.instagram.com/uoama/?hl=en,,,ASUO Student Organizations
298642,Hong Kong Student Association,HKSA,"<p>Hong Kong Student Association aims to foster closer ties among Hong Kong students and other Cantonese speaking students and to bridge Cantonese culture with the UO community. Established in 1987, HKSA was founded to help students from Hong Kong adjust and acclimate to American culture and educational system. Currently, HKSA strives to provide a space to gather students of different backgrounds with a mutual interest in Hong Kong as a society and culture. HKSA aims to promote cultural understanding of Hong Kong's diversity both to the university and community. We hope to encourage acceptance of cultural diversity and understanding of the beauty each culture offers.</p>","Hong Kong Student Association aims to foster closer ties among Hong Kong students and other Cantonese speaking students and to bridge Cantonese culture with the UO community.Established in 1987, HKSA was founded to help students from Hong Kong adjust a...",Tier 3 Student Organization,Active,https://linktr.ee/uo_hksa,https://www.facebook.com/uo.hksa,https://www.instagram.com/uo_hksa/?hl=en,,,ASUO Student Organizations
298644,UO Social Media Club,UO SMC,"We strive to connect students of all majors to professional opportunities within social media. The first Social Media club was brought back in 2017, to help individuals and organizations explore key issues facing our society as technologies transform the way we connect, communicate, collaborate and relate to each other. Now there are community chapters all across the United States. The Social Media Club enables individuals to explore their personal and professional passions by helping you connect with a community of your peers based on both geography and areas of interest. We are excited to bring the Social Media Club to the University of Oregon.","We strive to connect students of all majors to professional opportunities within social media. The first Social Media club was brought back in 2017, to help individuals and organizations explore key issues facing our society as technologies transform t...",Tier 1 Student Organization,Active,,http://facebook.com/facebook.com/UOSMC/,,http://twitter.com/twitter.com/uo_smc,,ASUO Student Organizations
298645,UO Real Estate Investment Group,UOREIG,"<p><span style=""font-weight: 400;"">The UO Real Estate Investment Group is a niche selection of undergraduate students who learn about the components of real estate investing, pitch real investment properties, and explore different facets of commercial real estate through peer-to-peer teaching, guest speakers, site tours, and case studies.The goal of the Real Estate Investment Club is to facilitate learning about real-world real estate investing skills, to guide students toward the many possible careers in commercial real estate, and to teach various hard and soft skills that are pertinent to anyone in the industry. </span></p>","UOREIG allows students to gain vital skills in Real Estate investment with the purpose of helping members gain networking opportunities, internships and even full-time employment. ",Tier 2 Student Organization,Active,https://blogs.uoregon.edu/realestateinvestmentgroup/,,https://www.instagram.com/uoreig/,,,ASUO Student Organizations
298646,Oregon Life,Oregon Life,"<p>Oregon Life is committed to make Chinese students fit in the new society faster and easier by spreading out valuable information through WeChat social network platforms, website, APP, Facebook, and Oregon Life digital magazines.we believes that we can become the most influential organization to provide the best service to Chinese students.</p>","Oregon Life is committed to make Chinese students fit in the new society faster and easier by spreading out valuable information through WeChat social network platforms, website, APP, Facebook, and Oregon Life digital magazines.we believes that we can ...",Tier 2 Student Organization,Active,,,,,,ASUO Student Organizations
298647,ASUO Constitution Court,Con Court,"<p><strong>Constitution Court</strong> is a five-member body appointed by the Student Body President and confirmed by Student Senate. Associate Justices serve &ldquo;lifetime&rdquo; terms for the duration of their time as UO students. The court has the authority to rule on any rule promulgated under it. This review power covers almost any action by ASUO government bodies, programs, and in special cases such as elections, actions by individual students within Student Organizations. The Court has broad powers to impose sanctions in order to compel compliance with its rulings.&nbsp;</p>\r\n<p>Broadly, the responsibilities of Constitution Court include:</p>\r\n<ul>\r\n<li>Uphold the ASUO Constitution and all related rules and bylaws; and</li>\r\n<li>Ratify rule changes; and</li>\r\n<li>Review appeals of lower courts (e.g. the ASUO Elections Board); and</li>\r\n<li>Apportion academic Senate seats.</li>\r\n</ul>\r\n<p>The composition of Constitution Court is outlined in the ASUO Constitution and the operating rules of the Court can be found in Constitution Court Rules.</p>","ASUO's Judicial Branch, or Constitution Court, is responsible for upholding the rules of the ASUO Constitution and any rules promulgated under it. The Court consists of five students, including two law students, who respond to inquiries and filings.",Student Government ,Active,,,,,,ASUO Student Organizations
298648,Design for America,DFA,"<p>We are a national organization that uses the human centered design thinking process to tackle social issues within our community. DFA is interdisciplinary, meaning anyone can join regardless of their background. Some examples of projects we have worked on in the past include funding for homelessness, safety on campus, reducing waste, saving the bees, etc. We meet every week on campus to research, prototype, and collaborate with community partners to work on solutions for social issues.</p>","We are a national organization that uses the human centered design thinking process to tackle social issues within our community. DFA is interdisciplinary, meaning anyone can join regardless of their background. Some examples of projects we have worked...",Hidden,Inactive,,https://www.facebook.com/UODesignForAmerica/,https://www.instagram.com/uo_dfa/?hl=en,,,ASUO Student Organizations
298649,"American Society of Heating, Refrigerating, and Air Conditioning Engineers",UO ASHRAE,"Formed in 1999, UO ASHRAE is the University of Oregon student chapter of the American Society of Heating, Refrigerating and Air Conditioning Engineers. ASHRAE focuses on enriching the experience of architecture and design students through knowledge of mechanical and environmental control systems in buildings. ASHRAE also works to increase integration of the many disciplines within design, construction, and science.  Members get to talk with professionals and other students, tour campus and community buildings, and see firsthand the inner workings of buildings that keep people comfortable and safe-places you never get a chance to see otherwise!  ASHRAE also provides travel opportunities around the US and hosts events like brewery and restaurant tours, guest speakers, and LEED Green Associates training workshops.","Formed in 1999, UO ASHRAE is the University of Oregon student chapter of the American Society of Heating, Refrigerating and Air Conditioning Engineers. ASHRAE focuses on enriching the experience of architecture and design students through knowledge of ...",Tier 1 Student Organization,Active,,,,,,ASUO Student Organizations
298650,Dance Oregon,Dance Oregon,"<p>Dance Oregon is a student run organization funded by the Associated Students of the University of Oregon (ASUO). Dance Oregon works in conjunction with the Dance Department to provide students with creative and artistically meaningful experiences such as workshops, lectures, guest artists, performance and choreography opportunities, and annual participation in the American College Dance Association (ACDA) convention. For information about meetings, please email us!</p>",Dance Oregon works in conjunction with the Dance Department to provide students with creative and artistically meaningful experiences!,Tier 4 Student Organization,Active,,,https://www.instagram.com/dance_oregon/,,,ASUO Student Organizations
298651,University of Oregon Dance Marathon,UODM,"<p>Duck Dance Marathon is a student organization that fundraises throughout the year for our local Children's Miracle Network Hospital - PeaceHealth Sacred Heart Medical Center at RiverBend in Springfield. We plan a variety of small and large events to raise money for the Pediatric and Neonatal Care Units at the Hospital. Our main event, Dance Marathon, brings together our student body and the Miracle Families that have benefitted from our fundraising efforts. Our organization is a great way for students to engage with the community, and raise funds for a cause that matters!</p>",Duck Dance Marathon is a student run organization that fundraises for the Children's Miracle Network Hospital - PeaceHealth Sacred Heart Medical Center at RiverBend in Springfield. We plan a variety of small events leading up to a large event in Spring.,Tier 2 Student Organization,Active,https://events.dancemarathon.com/index.cfm?fuseaction=donorDrive.event&eventID=4999,http://facebook.com/facebook.com/uodancemarathon,https://www.instagram.com/uo_duckdm/,http://twitter.com/twitter.com/UOdancemarathon,,ASUO Student Organizations
298654,University of Oregon Tuba-Euphonium Ensemble,Teuph,"<p>We are a group of students who play tuba and euphonium, and under the guidance of Professor Michael Grose, perform regularly throughout Eugene, Oregon, and the Pacific Northwest. We perform for middle and high schools as out-reach opportunities, regional and national conferences for our musicians to compete in, as well as on campus in quarterly concerts for the general public. Last year, our euphonium quartet was selected to compete in the International Tuba and Euphonium Conference, in Iowa.&nbsp;</p>","We are a group of students who play tuba and euphonium, and under the guidance of Professor Michael Grose, perform throughout Eugene, Oregon, and the Pacific Northwest.  We partake in various performance opportunities, strongly representing the UO.",Tier 2 Student Organization,Active,http://www.tubapeople.com/,https://www.facebook.com/Tuba-People-101455626584061/?fref=ts,,,,ASUO Student Organizations
298656,UO Test,UO Tes,,,Test Pages,Active,,,,,,ASUO Student Organizations
